{
  "$schema": "../../schemas/modelset.schema.json",
  "description": "Starter set -- three small, broadly useful models (~5GB total)",
  "models": {
    "qwen3-06b": {
      "repo": "Qwen/Qwen3-0.6B",
      "size_hint": "~1.4GB",
      "runtime": "vLLM / BF16",
      "role": "small generalist; fast local judge and classifier",
      "revision": "c1899de289a04d12100db370d81485cdf75e47ca"
    },
    "nomic-embed-text-v15": {
      "repo": "nomic-ai/nomic-embed-text-v1.5",
      "size_hint": "~2.1GB",
      "runtime": "sentence-transformers / TEI",
      "role": "embedding; retrieval baseline",
      "revision": "e9b6763023c676ca8431644204f50c2b100d9aab"
    },
    "faster-whisper-turbo": {
      "repo": "deepdml/faster-whisper-large-v3-turbo-ct2",
      "size_hint": "~1.5GB",
      "runtime": "CTranslate2 / faster-whisper",
      "role": "speech-to-text; CPU sidecar, zero VRAM",
      "revision": "4df90f75321148c3a29a9e2351b7ddf8f5b115a8"
    }
  },
  "sets": {
    "retrieval": ["nomic-embed-text-v15", "qwen3-06b"]
  },
  "aliases": {
    "whisper": "faster-whisper-turbo"
  }
}
